{
  "test_run_id": "TR-007",
  "campaign": "lumen-inspired-q3-2024",
  "bench": "P3-Lampoldshausen",
  "propellant": "LOX/LCH4",
  "scheduled_at": "2024-07-26T09:00:00+00:00",
  "shift": "early",
  "test_engineer": "A. Reuter",
  "is_fired": true,
  "duration_s": 30,
  "target_thrust_kN": 25,
  "target_mixture_ratio": 3.4,
  "lox_lot_id": "LOX-2024-03",
  "lch4_lot_id": "CH4-2024-04",
  "weather": {
    "temp_c": 23,
    "wind_kmh": 8,
    "humidity_pct": 58,
    "cloud": "OVC"
  },
  "igniter_check": "PASS",
  "notes_brief": "Confirmation fire. Steady envelopes match TR-001/TR-002. Campaign complete."
}
