{
  "test_run_id": "TR-009",
  "campaign": "lumen-inspired-q3-2024",
  "bench": "P3-Lampoldshausen",
  "propellant": "LOX/LCH4",
  "scheduled_at": "2024-08-01T09:00:00+00:00",
  "shift": "early",
  "test_engineer": "T. Marek",
  "is_fired": true,
  "duration_s": 30,
  "target_thrust_kN": 25,
  "target_mixture_ratio": 3.4,
  "lox_lot_id": "LOX-2024-03",
  "lch4_lot_id": "CH4-2024-05",
  "weather": {
    "temp_c": 19,
    "wind_kmh": 12,
    "humidity_pct": 71,
    "cloud": "BKN"
  },
  "igniter_check": "PASS",
  "notes_brief": "Mixture ratio sweep \u2014 LOX/LCH4 o/f ratio stepped to 3.6 during steady_state throttle point."
}
