{
  "test_run_id": "TR-013",
  "campaign": "lumen-inspired-q3-2024",
  "bench": "P3-Lampoldshausen",
  "propellant": "LOX/LCH4",
  "scheduled_at": "2024-08-13T09:00:00+00:00",
  "shift": "early",
  "test_engineer": "S. Holzwarth",
  "is_fired": true,
  "duration_s": 30,
  "target_thrust_kN": 25,
  "target_mixture_ratio": 3.4,
  "lox_lot_id": "LOX-2024-05",
  "lch4_lot_id": "CH4-2024-07",
  "weather": {
    "temp_c": 25,
    "wind_kmh": 8,
    "humidity_pct": 47,
    "cloud": "SCT"
  },
  "igniter_check": "PASS",
  "notes_brief": "Pre-certification reference fire. All channels within Phase 1 envelope. Cleared for qualification."
}
