{
  "test_run_id": "TR-004",
  "campaign": "lumen-inspired-q3-2024",
  "bench": "P3-Lampoldshausen",
  "propellant": "LOX/LCH4",
  "scheduled_at": "2024-07-17T09:00:00+00:00",
  "shift": "late",
  "test_engineer": "T. Marek",
  "is_fired": true,
  "duration_s": 30,
  "target_thrust_kN": 25,
  "target_mixture_ratio": 3.4,
  "lox_lot_id": "LOX-2024-02",
  "lch4_lot_id": "CH4-2024-02",
  "weather": {
    "temp_c": 28,
    "wind_kmh": 7,
    "humidity_pct": 41,
    "cloud": "FEW"
  },
  "igniter_check": "PASS",
  "notes_brief": "Vibration spike on fuel turbopump observed during ramp_up at t=8 s, sustained ~0.5 s peaking 12 g rms. Engine completed steady_state nominally; suspect bearing precursor. Recommending teardown."
}
