{
  "test_run_id": "TR-005",
  "campaign": "lumen-inspired-q3-2024",
  "bench": "P3-Lampoldshausen",
  "propellant": "LOX/LCH4",
  "scheduled_at": "2024-07-20T09:00:00+00:00",
  "shift": "early",
  "test_engineer": "L. Voss",
  "is_fired": false,
  "duration_s": 0,
  "target_thrust_kN": 25,
  "target_mixture_ratio": 3.4,
  "lox_lot_id": "LOX-2024-02",
  "lch4_lot_id": "CH4-2024-03",
  "weather": {
    "temp_c": 30,
    "wind_kmh": 11,
    "humidity_pct": 38,
    "cloud": "BKN"
  },
  "igniter_check": null,
  "notes_brief": "Hold day. Bearing teardown / replacement / re-balance. No fire."
}
