{
  "test_run_id": "TR-010",
  "campaign": "lumen-inspired-q3-2024",
  "bench": "P3-Lampoldshausen",
  "propellant": "LOX/LCH4",
  "scheduled_at": "2024-08-04T09:00:00+00:00",
  "shift": "late",
  "test_engineer": "L. Voss",
  "is_fired": true,
  "duration_s": 30,
  "target_thrust_kN": 25,
  "target_mixture_ratio": 3.4,
  "lox_lot_id": "LOX-2024-04",
  "lch4_lot_id": "CH4-2024-05",
  "weather": {
    "temp_c": 22,
    "wind_kmh": 5,
    "humidity_pct": 58,
    "cloud": "FEW"
  },
  "igniter_check": "PASS",
  "notes_brief": "Throttle-deep test \u2014 minimum throttle point sustained 6 s at 40% thrust. Stable combustion."
}
