{
  "test_run_id": "TR-001",
  "campaign": "lumen-inspired-q3-2024",
  "bench": "P3-Lampoldshausen",
  "propellant": "LOX/LCH4",
  "scheduled_at": "2024-07-08T09:00:00+00:00",
  "shift": "early",
  "test_engineer": "T. Marek",
  "is_fired": true,
  "duration_s": 30,
  "target_thrust_kN": 25,
  "target_mixture_ratio": 3.4,
  "lox_lot_id": "LOX-2024-01",
  "lch4_lot_id": "CH4-2024-01",
  "weather": {
    "temp_c": 24,
    "wind_kmh": 6,
    "humidity_pct": 52,
    "cloud": "FEW"
  },
  "igniter_check": "PASS",
  "notes_brief": "Bench commissioning fire. All sensors green. Mixture ratio close to target."
}
