{
  "test_run_id": "TR-006",
  "campaign": "lumen-inspired-q3-2024",
  "bench": "P3-Lampoldshausen",
  "propellant": "LOX/LCH4",
  "scheduled_at": "2024-07-23T09:00:00+00:00",
  "shift": "late",
  "test_engineer": "T. Marek",
  "is_fired": true,
  "duration_s": 30,
  "target_thrust_kN": 25,
  "target_mixture_ratio": 3.4,
  "lox_lot_id": "LOX-2024-02",
  "lch4_lot_id": "CH4-2024-03",
  "weather": {
    "temp_c": 25,
    "wind_kmh": 5,
    "humidity_pct": 55,
    "cloud": "SCT"
  },
  "igniter_check": "PASS",
  "notes_brief": "Re-test post bearing replacement. Fuel-pump vibration nominal across the full burn (peak ~3.6 g rms ramp_up, <2.4 g steady_state)."
}
