{
  "test_run_id": "TR-015",
  "campaign": "lumen-inspired-q3-2024",
  "bench": "P3-Lampoldshausen",
  "propellant": "LOX/LCH4",
  "scheduled_at": "2024-08-19T09:00:00+00:00",
  "shift": "early",
  "test_engineer": "T. Marek",
  "is_fired": true,
  "duration_s": 30,
  "target_thrust_kN": 25,
  "target_mixture_ratio": 3.4,
  "lox_lot_id": "LOX-2024-05",
  "lch4_lot_id": "CH4-2024-08",
  "weather": {
    "temp_c": 20,
    "wind_kmh": 7,
    "humidity_pct": 67,
    "cloud": "BKN"
  },
  "igniter_check": "PASS",
  "notes_brief": "Qualification fire 2 \u2014 repeat confirmation. Campaign complete. All channels within spec."
}
