{
  "test_run_id": "TR-011",
  "campaign": "lumen-inspired-q3-2024",
  "bench": "P3-Lampoldshausen",
  "propellant": "LOX/LCH4",
  "scheduled_at": "2024-08-07T09:00:00+00:00",
  "shift": "early",
  "test_engineer": "A. Reuter",
  "is_fired": true,
  "duration_s": 30,
  "target_thrust_kN": 25,
  "target_mixture_ratio": 3.4,
  "lox_lot_id": "LOX-2024-04",
  "lch4_lot_id": "CH4-2024-06",
  "weather": {
    "temp_c": 24,
    "wind_kmh": 9,
    "humidity_pct": 50,
    "cloud": "SCT"
  },
  "igniter_check": "PASS",
  "notes_brief": "New LOX batch LOX-2024-04 validated. All channels nominal, pressures within 0.5% of Phase 1 baseline."
}
